fullName,billingAddress,phoneNumber,packageCode,registerdDate
M.A Silva,No.101 Galle Road Dehiwala,0719633911,A,10/25/2017 14:01:16
D.T Perera,No.123 Sumagi Mawatha Walgama,0715535452,A,04/17/2017 10:25:34
M.N Sahabandu,No.201 Perera Road Nawalapitiya,0775678765,A,09/10/2017 15:14:19
V.C Munasinge,No.247 Subodhi Mawatha Kirinda,0729622911,B,09/30/2017 17:14:19
T.C Wellappili,No.324 Wijerama Junction Hambantota,0755670765,B,09/10/2011 11:54:19
M.N Perera,No.113 Pasal Mawatha Kalubowila,0728800765,C,09/30/2010 09:54:39
W.A Appuhamu,No.25A Temple Road Yakkala,0771450065,D,07/20/2013 10:24:45